Female,22,2,1,1,.,1,1,.,.,4,4,4,4,4,1,1,1,1,4,1,1,4,1,1,1,1,1,1,1,5,5,5,5,5,4,4,4,4,5,4,4,4,2,4,4,4,4,4,4,4,5,5,5,5,4,5,4,3,3,4,4,4,.,.,5,"I really enjoyed this training session, particularly the live demonstrations. ",2.5,4.5,1.375,3.75,21,48,24,35
Female ,22,4,1,1,,.,.,.,.,.,4,4,5,4,1,1,1,1,2,1,1,2,1,1,1,1,1,1,2,4,5,5,5,5,.,.,.,.,5,.,.,.,.,.,.,.,.,.,.,.,.,.,.,.,.,.,.,.,.,.,.,.,.,I don't have patient contact as part of my role. I could [illegible] use the trauma informed considerations [illegible] the emergency [illegible] of restraints during a teachable moment etc. ,4,"The teaching was very informative and I find the [illegible] easy to implement especially self-care. camhstaff is a very knowledgable facilitator. She had the staff engaged. Unfortunately, this I believe is not applicable (TIDES 3) to my role as a nurse educator. ",2.083333333,2.416666667,1.25,0,17,10,24,0
Male ,22,1,1,1,,1,1,.,.,4,4,4,4,4,4,4,4,3,4,3,4,4,4,4,4,3,3,4,4,4,5,5,5,5,5,5,5,5,5,5,5,5,5,5,5,5,5,5,5,5,5,5,5,5,5,5,4,4,4,4,4,4,.,.,5,This was an excellent course with very knowledgable facilitators ,3.833333333,4.916666667,3.75,5,46,60,33,40
Female,23,1,1,1,.,1,1,.,.,4,3,3,4,3,2,2,2,2,3,3,2,2,2,1,1,1,1,2,2,4,3,3,4,4,3,3,3,3,3,.,.,3,3,3,3,3,3,3,3,5,3,5,5,4,2,5,4,4,3,3,3,3,Triangle technique/triangulation vs crowding. Using close-hip proximity with physical restraint while protecting my head. ,.,4,.,2.75,2.75,1.5,3,25,31,20,30
Female,23,3,1,1,.,1,1,1,.,5,5,5,5,5,5,5,5,5,5,5,5,5,2,4,3,3,3,5,5,5,5,5,5,5,5,5,5,5,5,5,5,5,5,5,5,5,5,5,5,4,4,4,5,1 - videos didn't work,N/A,5,4,4,4,4,4,4,Will use in regards to managing aggressive situation and will feel more confident if support is needed for mechanicals ,.,4,"Wish the training accommodate past-time availability, i.e. offered on weekends, evening option? ",5,5,3.75,5,54,60,36,37
Female,23,3,1,1,.,1,1,.,.,4,4,4,4,4,4,4,4,4,4,4,4,4,4,4,4,4,4,4,4,5,4,4,5,5,4,4,4,4,4,4,4,4,4,4,4,4,4,4,4,5,5,5,5,5,5,5,4,4,4,4,4,4,.,.,5,.,4,4.25,4,4,48,49,34,36
Female,23,3,1,1,.,.,.,.,.,4,4,4,3,3,2,2,2,2,4,1,1,4,3,2,2,2,2,4,4,4,4,4,4,4,4,4,4,4,4,4,4,5,4,4,4,4,4,4,4,4,4,4,4,4,4,4,3,3,3,3,3,3,.,.,4,.,2.666666667,4,2.875,4.125,28,49,28,32
Female,23,3,1,1,.,.,.,.,.,4,3,5,5,5,2,2,2,3,4,3,3,5,3,2,1,1,1,4,3,5,5,5,5,5,5,5,5,5,5,5,5,5,4,.,4,4,5,5,5,5,4,5,4,4,3,5,4,4,4,4,4,4,More confident with restraints and the proper holds ,N/A,4,Great facilitators! ,3.416666667,5,2.5,4,35,53,29,37
Male,23,2,1,1,.,.,.,.,.,5,5,5,5,5,5,5,5,5,5,5,5,5,5,5,5,5,5,5,5,5,5,5,5,5,5,5,5,5,5,5,5,5,5,5,5,5,5,5,5,5,5,5,5,5,5,5,4,4,4,4,4,4,.,.,5,.,5,5,5,5,60,60,40,40
Male,23,1,1,1,.,2,2,1,.,4,4,3,4,4,1,1,1,1,3,3,3,1,1,2,1,1,1,2,1,4,5,4,3,4,5,5,5,4,4,5,5,3,4,5,5,5,4,4,5,5,3,4,5,2,3,2,3,3,3,1,1,1,.,"Not a Forensic unit or a unit with intense (aggressive clients). Clients all voluntary, can leave when they want",4,N/A. Great Job!,2.666666667,4.416666667,1.25,4.375,22,54,21,35
Male,23,2,1,1,.,.,1,1,PMAB,2,2,2,2,2,2,2,2,2,2,2,2,3,3,3,3,3,3,3,3,4,4,4,4,4,4,4,4,4,4,4,4,4,4,4,4,4,3,4,4,4,4,5,4,4,4,4,3,3,3,3,3,3,.,.,4,.,2,4,3,3.875,28,48,28,32
Female,23,3,1,1,.,1,1,2,.,4,4,4,3,3,3,3,3,3,3,4,4,3,3,3,3,3,4,3,4,3,3,4,3,4,4,4,4,4,4,4,4,4,4,4,4,4,4,4,4,4,4,4,4,3,3,4,4,3,4,4,4,4,.,.,4,.,3.416666667,3.75,3.25,4,38,48,27,32
Female,23,1,1,1,.,2,1,1,CPR & Standard first aid,4,4,4,5,5,4,3,3,4,4,4,4,4,4,3,3,3,4,3,4,4,4,4,5,5,4,4,4,4,3,3,3,4,5,4,4,4,4,4,5,5,5,5,5,5,5,5,4,4,4,4,4,4,Demonstrating to other staff. Continue to check restraints that all are there (Check-lists). ,.,5,.,4,3.916666667,3.5,4.25,45,47,31,37
Female,23,1,1,1,.,2,2,1,New hire tides 2018,4,4,4,5,4,3,3,4,3,4,3,3,4,3,3,2,2,2,4,3,4,5,5,5,4,4,4,4,4,5,5,5,4,4,4,4,4,4,4,4,5,5,5,5,4,5,5,3,4,4,3,4,4,Practice often to utilize and not lose skills. Everyday use of de-escalation. Educate others. ,.,5,Very knowledgeable facilitators. Thank you! ,3.666666667,4.5,2.875,4,39,51,30,36
Female,23,.,.,.,.,.,.,.,.,4,2,4,4,4,2,2,1,1,2,1,1,4,3,3,2,2,2,3,3,5,4,4,5,4,5,4,4,4,4,4,4,3,3,4,3,3,3,4,4,5,5,5,5,3,3,5,4,4,4,4,3,3,Implement regular weekly debriefs,.,4,Provide hand sanitizer - lots of technique. ,2.333333333,4.25,2.75,3.375,26,46,28,34
Male,23,3,1,1,.,1,1,.,.,4,4,4,3,3,3,3,3,3,3,3,4,4,4,4,4,4,4,4,4,4,4,4,4,4,4,4,4,4,4,3,4,4,3,4,4,3,4,4,4,4,4,5,4,4,4,4,4,4,4,4,4,4,Incorporate the importance of debrief. Self-awareness and self-management,.,5,Amazing instructors & great application ,3.333333333,3.916666667,4,3.75,41,46,32,32
Male,23,3,1,1,.,1,1,2,.,2,4,4,4,4,4,4,4,4,4,4,4,4,4,5,5,5,4,4,5,4,4,4,4,4,4,4,4,4,4,4,4,4,4,4,4,4,4,4,4,4,4,4,4,4,4,4,1,1,1,1,1,1,Application of restraints to bed ,.,.,.,3.833333333,4,4.5,4,50,48,34,32
Female,23,2,1,1,.,1,1,1,.,4,4,4,4,4,4,4,4,4,4,4,4,4,2,2,2,2,2,2,4,4,4,4,4,4,4,4,4,4,4,4,5,4,4,4,4,4,4,5,5,5,5,5,5,5,5,5,4,4,4,4,4,4,.,.,.,.,4,4.083333333,2.5,4.25,42,49,26,38
Male,23,2,2,1,.,.,.,.,.,3,2,4,4,4,2,2,1,2,3,3,2,3,1,1,1,1,1,2,1,4,4,4,4,4,5,5,5,5,5,5,5,4,4,4,4,5,5,5,5,5,4,5,5,5,5,5,3,2,4,3,4,4,.,.,5,.,2.666666667,4.583333333,1.375,4.5,25,55,21,39
Female,23,1,1,1,.,.,.,.,.,5,5,5,5,5,5,5,5,5,5,5,5,5,5,5,5,5,5,5,5,5,5,5,5,5,5,5,5,5,5,5,5,4,4,4,4,4,4,4,4,5,5,5,5,5,5,4,4,4,4,4,4,4,1. A better understanding of 5-6 people needed for using and applying physical restraints and what role each person will have. 2) The importance of debriefing with client as well as staff. ,.,5,The instructors were amazing!! I really enjoyed the material and the way it was taught. <3 :) ,5,5,5,4,60,56,40,36
.,23,1,1,1,.,.,.,.,.,4,2,1,4,3,1,1,1,1,1,1,1,3,1,1,1,1,1,1,1,5,4,4,4,4,4,4,4,4,4,5,5,1,2,2,2,2,2,2,4,5,2,3,3,4,4,5,3,4,3,3,4,2,Build more self-care strategies. Practical physical restraints with colleagues ,.,5,"I really enjoyed it, it was a very good refresher.",1.75,4.25,1.25,2.125,16,41,21,23
Female,23,2,1,1,.,1,1,.,.,4,3,4,4,4,2,2,2,2,3,3,3,5,2,2,2,1,2,3,3,5,5,5,5,5,5,5,5,5,5,5,5,5,4,4,4,4,4,4,4,4,2,5,3,3,2,4,3,3,4,3,4,4,I learned how to apply mechanical restraints. I learned the importance of having someone lead a 5 person hold. .,.,4,More enforcement in people doing a role in 'role play'. Very slow process in the role playing simulation,3,5,2.5,4.125,32,57,29,30
Female,23,1,1,1,.,2,.,2,.,4,3,3,4,3,1,1,1,1,2,2,3,3,1,1,1,1,1,2,3,4,4,3,3,3,4,4,4,4,4,3,3,3,2,2,2,2,2,2,2,4,3,4,4,3,3,5,3,2,3,3,3,3,.,.,4,.,2.333333333,3.583333333,1.625,2.125,20,38,21,23
Female,23,1,1,1,.,1,1,.,.,3,4,4,4,5,2,2,2,2,4,3,3,3,3,3,3,3,3,4,3,5,5,5,4,5,4,4,4,4,5,4,5,4,3,3,3,3,4,4,5,4,4,4,5,4,3,4,4,4,3,3,3,3,Will try to do more frequent/thorough debriefs with clients and co-workers. Will try to practice more of applying restraints to the stretcher.,.,4,Great- feel like I just need to practice the motions of physical restraints more and continue to practice applying restraints. ,3.166666667,4.5,3.125,3.625,35,48,32,33
Female,23,3,1,1,.,.,.,.,.,4,4,4,4,4,4,4,4,4,4,4,4,4,4,4,4,4,4,4,4,.,.,.,.,.,.,.,.,.,.,.,.,.,.,.,.,.,.,.,.,.,.,.,.,.,.,.,.,.,.,.,.,.,.,.,.,.,4,0,4,0,48,0,16,0
Female,23,3,1,1,.,.,.,.,.,3,4,4,4,4,2,2,2,2,4,2,3,3,2,2,2,2,2,3,3,.,.,.,.,.,.,.,.,.,.,.,.,4,4,4,4,4,4,4,4,5,5,5,5,5,5,5,4,4,4,4,4,4,"Self-care, debriefinf, and appropriate use and application of restraints ",.,.,.,3,0,2.375,4,30,16,10,36
Male,23,3,1,1,.,.,.,.,.,4,4,4,4,5,4,4,4,2,4,2,4,4,2,4,4,2,2,4,4,4,5,5,5,5,5,5,.,4,4,4,4,5,4,5,5,.,4,4,4,5,5,5,5,5,5,5,4,4,4,4,4,4,I will better understand criteria for making decision on initiating and applying restraints ,.,5,"Very knowledge, supportive, and entertaining instructors. Keep up the great work! ",3.75,4.166666667,3.25,3.875,43,50,31,32
Female ,23,2,1,.,,.,.,.,.,4,4,4,4,4,2,2,2,2,4,3,3,4,3,2,2,2,2,4,2,5,5,5,5,5,5,5,5,5,5,5,5,5,5,5,5,5,5,5,5,5,5,5,5,5,5,5,4,4,3,4,4,4,I understand how comforting putting a blanket over a restrained person could be. Importnace of looking down and not chit chatting during restraint.,.,5,All facilitators excellent!,3.166666667,5,2.625,5,33,60,30,40
Female ,23,5,1,1,,1,1,.,.,4,4,4,4,4,2,2,2,2,2,2,2,2,2,2,2,2,2,2,2,4,4,4,4,4,4,4,4,4,4,4,4,4,4,4,4,4,4,4,4,5,5,5,5,5,4,5,4,4,4,4,4,4,increased opportunity for mocks/practice. Increased listening to and empowerment of team members re: desicison making ,.,5,Better space than we often have at CAMH for such classes. ,2.833333333,4,2,4,26,48,24,36
.,24,3,1,1,2,.,1,.,.,3,3,4,4,4,4,4,4,3,3,4,4,4,4,4,4,4,3,4,4,5,5,5,5,5,5,5,5,5,5,5,5,5,5,5,5,5,5,5,5,5,5,5,5,5,.,5,4,4,4,4,4,4,The topics are useful to my work. ,.,5,Maybe a better venue for training (quiet and spacious) ,3.666666667,5,3.875,5,46,60,35,40
Female ,24,1,1,1,.,1,2,2,.,5,4,4,5,4,4,4,4,3,4,3,3,3,3,3,3,3,3,3,4,5,5,5,5,5,5,5,5,4,5,4,4,5,4,4,3,3,3,5,5,5,4,5,4,4,.,5,4,4,4,4,4,4,Increase self-care. Encourage more team members in debriefing,.,5,.,3.916666667,4.75,3.125,4,41,53,33,34
Female ,24,1,1,1,.,.,1,.,.,4,4,4,4,4,.,.,.,.,.,4,4,4,4,4,4,4,4,4,4,.,.,.,.,.,.,.,.,.,.,.,.,.,.,.,.,.,.,.,.,.,.,.,.,.,.,.,.,.,.,.,.,.,.,.,.,.,2.333333333,0,4,0,28,0,16,0
Female,24,6,1,1,.,1,.,2,.,3,4,4,4,4,3,3,3,3,4,3,3,4,4,3,3,3,3,3,3,4,4,4,4,5,4,4,4,4,4,2,3,4,1,4,4,4,4,4,4,5,5,5,5,5,5,,4,4,3,4,4,4,.,.,5,Very informative and will continue to practice restrain (mechanical) ,3.416666667,3.833333333,3.25,3.625,40,43,28,36
Female,24,5,1,1,.,.,1,2,.,4,4,5,4,4,4,4,4,4,4,4,4,5,5,4,4,4,4,4,5,4,5,5,4,4,4,4,4,4,4,4,4,5,4,4,4,4,4,4,5,5,5,5,5,5,5,5,4,4,4,4,4,4,1. Restraint use 2. De-escalation ,.,5,Very satisfied ,4.083333333,4.166666667,4.375,4.25,50,49,35,37
.,24,1,1,1,.,1,Not sure ,2,.,4,5,5,4,4,1,1,1,4,5,5,5,4,4,1,1,1,4,4,5,5,5,5,5,5,5,5,5,5,5,5,5,5,5,4,4,4,4,4,5,5,5,5,5,3,5,5,4,4,4,4,4,4,"1) Appropriately use team control/level 1-3 controls- forgot these prior to today, was not confident 2) Appropriate use of extenders/shoulders",.,5,Thank you very much for the training. It was very helpful and free of fluff- presentation concise and well organized ,3.666666667,5,3,4.375,36,58,34,37
Female,24,2,1,1,.,.,1,2,.,5,4,4,4,4,4,4,4,4,4,4,4,4,4,4,4,4,4,4,4,5,5,5,4,4,4,4,4,4,4,4,4,4,4,4,4,4,4,4,4,5,5,5,5,5,.,5,4,4,4,4,4,4,.,.,5,.,4.083333333,4.25,4,4,48,48,35,36
.,24,1,1,1,.,1,.,1,Non-violent crisis intervention ,4,5,5,5,4,1,1,1,1,5,2,1,5,1,1,1,1,1,1,1,5,5,5,5,5,5,5,5,5,5,5,5,5,5,5,5,5,5,5,5,5,5,5,5,5,.,5,4,4,4,4,4,4,.,.,5,Best TIDES Day ever! ,2.916666667,5,1.5,5,24,60,24,40
Female,24,2,1,1,.,.,.,.,.,4,4,4,4,4,3,3,3,3,4,3,3,3,3,3,3,3,3,3,3,4,4,4,4,4,4,4,4,4,4,4,4,4,4,4,4,4,4,4,4,5,5,5,5,5,.,5,4,4,4,4,4,4,.,.,4,.,3.5,4,3,4,38,48,28,36
Female,24,4,1,1,.,.,.,.,.,2,2,4,4,4,.,2,2,2,2,2,4,2,2,2,2,1,1,2,4,4,4,4,.,4,4,4,.,4,4,4,4,2,4,4,4,4,4,4,4,5,5,5,4,4,5,5,4,4,4,4,4,4,.,.,5,.,2.5,3.333333333,2,3.75,26,42,20,35
Male,24,.,.,.,.,.,.,.,.,4,4,3,3,3,4,3,3,3,4,4,4,4,4,3,3,3,3,3,4,4,4,4,4,4,4,4,4,4,4,4,4,4,4,4,4,4,4,4,4,5,3,2,4,5,4,5,3,3,3,3,3,3,Proper use of limb restraints ,.,3,Great job,3.5,4,3.375,4,42,48,29,30
Female,24,2,1,1,.,1,1,1,PMAB,2,2,2,2,2,2,2,2,2,2,2,2,2,2,2,2,2,2,2,2,4,4,4,4,4,4,4,4,4,4,4,4,4,4,4,4,4,4,4,4,4,4,4,4,4,4,4,2,2,2,2,2,2,.,.,3,.,2,4,2,4,24,48,24,32
Male,24,1,.,.,.,.,.,.,.,4,4,4,5,5,4,4,3,3,3,5,5,3,4,4,4,3,4,4,4,4,3,4,5,5,4,4,4,4,4,4,4,4,4,4,4,3,3,4,4,4,5,5,5,4,4,5,3,4,4,3,3,3,.,.,4,.,4.083333333,4.083333333,3.75,3.75,47,49,31,33
Male,24,1,1,,.,1,1,1,PMAB,4,4,5,5,4,4,4,4,4,4,4,4,4,4,4,4,4,4,4,4,4,4,4,5,5,5,5,5,5,5,5,5,5,5,5,5,5,.,.,.,.,5,5,5,5,5,5,4,4,4,4,4,4,Patient debriefing and properly placing restraints ,.,5,.,4.166666667,4.75,4,3.125,48,60,33,20
.,24,1,1,1,.,1,1,2,.,5,5,5,5,4,3,3,3,3,5,3,4,4,3,3,3,3,3,4,4,5,5,5,5,5,5,5,5,5,5,5,5,5,5,5,5,5,5,5,5,5,5,5,5,5,5,5,4,4,4,4,4,4,Participate more in code white and mindfulness,.,5,.,4,5,3.375,5,41,60,34,40
Male,24,1,1,1,.,"1,2",1,2,.,4,4,5,5,5,4,4,4,4,4,4,4,4,5,4,4,4,4,4,4,5,5,5,5,5,5,5,5,5,5,5,5,5,5,5,5,5,5,5,5,5,5,5,5,5,5,5,4,4,4,4,4,4,.,.,5,.,4.25,5,4.125,5,50,60,36,40
Female,24,2,1,1,.,1,1,1,.,5,5,5,4,5,5,5,5,5,5,5,5,5,5,5,5,5,5,4,5,5,5,5,5,5,5,5,5,5,5,5,5,5,5,5,5,5,5,5,5,5,5,5,5,4,4,5,4,4,4,4,4,4,New adjustment when applying the limb restraints with less pin/locks. Application on extenders,.,5,Interested in getting back to training/teaching,4.916666667,5,4.875,5,60,60,39,40
Male,24,2,1,1,.,.,1,.,.,4,4,5,4,4,3,3,3,4,4,4,4,4,4,3,3,3,4,4,4,4,5,5,5,5,5,5,5,5,5,5,5,5,5,5,5,5,5,5,5,5,5,5,4,4,4,5,4,4,3,4,4,4,.,.,4,.,3.833333333,4.916666667,3.625,5,43,60,34,39
Female,24,1,1,1,.,1,1,2,.,4,3,4,3,4,3,3,3,3,3,3,4,4,3,3,3,3,3,4,3,4,4,4,4,3,4,4,4,4,3,4,4,4,4,4,3,3,4,4,4,3,4,4,4,4,5,5,3,3,3,3,4,4,.,.,4,"It was very useful Training, especially regarding applying mechanical restraints and techniques physical restraints. ",3.333333333,3.833333333,3.25,3.75,39,45,29,30
. ,24,2,1,1,.,.,1,1,Staff Debrief Training ,4,4,4,4,4,4,3,3,3,5,5,5,4,5,4,3,3,.,4,4,4,4,4,4,4,4,4,4,3,4,5,5,4,4,4,4,4,3,4,4,4,4,4,4,4,3,3,4,3,3,3,4,4,Team approaches,.,4,I'd like the learning handout. Video strategies on controls on I-Care is key. ,4,4.083333333,3.375,3.875,48,49,27,31
Male,24,2,1,1,.,.,1,1,PMAB,4,3,4,4,4,1,1,1,1,2,1,1,2,1,1,1,1,1,1,1,4,4,4,4,4,4,4,4,4,4,4,4,4,4,4,4,4,4,4,4,3,2,5,5,5,5,5,3,2,3,2,2,2,.,.,4,.,2.25,4,1.125,4,17,48,20,31
Female,24,3,1,1,.,1,.,1,PMAB,4,5,2,5,5,2,2,2,2,4,2,2,4,2,2,2,2,2,2,2,4,4,4,4,4,4,4,4,4,4,4,4,4,2,2,2,2,2,2,2,5,5,5,5,5,5,5,3,4,4,4,4,4,.,.,5,.,3.083333333,4,2.25,2.25,31,42,24,28
Female,24,1,1,1,.,1,1,2,.,4,4,5,4,4,2,2,2,3,4,3,3,4,2,2,2,2,2,3,3,5,5,5,5,5,4,4,4,4,5,4,4,4,4,.,3,3,3,4,4,5,4,5,5,4,2,5,4,3,4,4,4,4,Proper use of mechanical restraints,.,4,Thank you! It was great :) ,3.333333333,4.5,2.5,3.125,33,45,30,33
Female,24,1,1,1,.,1,1,1,PMAB,4,4,5,5,4,2,2,1,1,5,2,4,3,2,2,2,1,1,3,4,5,4,5,5,4,4,4,4,4,4,5,5,4,5,3,3,3,3,4,5,5,5,4,5,5,4,5,4,3,3,4,4,4,Look into great white code for clients. Better practice when it comes to restraints events. ,.,5,Facilitators were excellent!!,3.25,4.416666667,2.25,3.75,30,49,28,34
Female,24,1,1,1,.,.,.,1,Through my other job,4,4,5,3,4,5,5,5,5,4,5,5,4,5,5,5,5,5,5,5,4,4,4,3,4,5,5,5,5,4,5,5,4,5,5,5,5,5,4,5,4,4,4,4,5,4,5,4,3,2,3,3,3,Continuing to use trauma-informed care ,.,4,The instructors were good. Thanks again!,4.5,4.416666667,4.875,4.75,57,57,35,35
Male ,24,1,.,.,.,.,.,.,.,4,4,4,3,4,3,1,1,1,1,2,1,4,1,1,1,1,1,3,1,4,4,3,4,4,3,3,3,4,4,3,3,4,3,3,2,2,3,2,3,4,4,2,5,5,3,4,4,4,4,4,4,4,.,.,4,.,2.416666667,3.5,1.625,2.75,21,39,21,25
Female ,24,3,.,.,.,.,.,.,.,4,4,4,4,4,4,4,4,4,4,4,4,4,4,4,4,4,4,4,4,5,5,4,4,4,4,4,4,4,4,4,4,4,4,4,4,4,4,4,4,5,5,5,5,5,5,5,4,4,4,4,4,4,"If need be, more confident ",Will use it ,5,Good presenters,4,4.166666667,4,4,48,48,34,36
Female ,24,1,1,1,.,2,2,2,.,5,4,4,5,5,3,2,2,4,3,2,2,4,2,2,2,2,2,3,4,5,5,4,5,5,4,4,4,4,5,4,5,4,4,4,4,4,4,4,5,5,4,4,4,4,3,4,4,4,4,4,4,4,Applying restraints and how to hold aggressive client ,.,4,Could be more concise,3.416666667,4.5,2.625,4.125,33,51,30,34
Female ,24,1,1,2,.,2,2,1,Code training ,4,4,4,4,4,1,1,1,1,4,3,3,4,3,3,3,3,3,4,4,5,5,5,5,5,5,5,5,5,5,5,5,5,5,5,5,5,5,5,5,5,5,5,5,5,5,5,4,4,4,4,4,4,Used in de-escalation techniques ,.,5,I loved the restraints portion ,2.833333333,5,3.375,5,31,60,34,40
Female ,24,1,1,1,.,1,1,.,.,4,3,3,4,4,3,3,3,3,4,3,3,3,3,3,3,3,3,4,4,4,4,4,4,4,4,4,4,4,4,4,4,4,4,5,5,5,5,5,5,5,5,5,5,5,5,5,4,4,4,4,4,4,Use what I learn to plan how to apply the different levels of restraints when a situation requires it ,.,5,.,3.333333333,4,3.25,4.75,38,50,30,40
Female ,24,1,1,1,.,.,.,.,.,2,2,1,3,3,1,1,1,1,2,2,2,1,1,1,1,1,1,2,2,4,5,4,4,5,5,5,5,4,4,4,4,4,4,5,5,5,4,4,5,5,3,4,5,5,5,5,4,4,4,4,4,4,"Restraint use- putting on and taking off, self care--> wellness Centre ",.,5,Great instructors very thorough ,1.75,4.416666667,1.25,4.5,17,54,23,35
Female ,24,1,1,1,.,2,2,2,.,4,4,4,5,5,3,3,3,4,4,4,4,2,2,3,3,3,2,2,2,5,5,5,5,5,5,5,5,5,5,5,5,4,4,4,4,4,4,5,5,5,4,4,3,3,4,5,4,4,4,4,3,3,I intend to use my awareness of different trauma informed strategies than using restraints. Also I will use the great self-care ideas ,.,4,.,3.916666667,5,2.375,4.25,40,56,29,34
Male ,24,1,1,1,.,2,2,2,.,4,4,4,4,4,4,4,3,3,3,4,4,3,4,4,4,3,3,3,3,4,4,4,4,4,4,4,4,4,4,4,4,4,4,4,4,4,4,4,4,4,4,4,4,5,5,4,3,3,2,2,2,2,I will use it in practice ,.,4,Use more time to go over policies and more time for documentation of restraints ,3.75,4,3.375,4,44,48,28,32
Female ,24,1,1,1,.,2,2,1,.,4,5,4,4,5,3,3,3,3,4,4,4,4,3,3,3,3,3,3,3,4,5,5,5,5,5,5,5,5,5,5,5,5,4,4,4,4,4,4,4,5,3,5,5,5,4,4,4,4,3,4,4,4,"Restraint techniques, self-defense techniques w/o use of force ",.,4,Unneccessary time spend on mindfulness exercise - everyone has their own way/strategies for mindfulness - not just breathing exercises -> not conducive to everyone self-care section not needed or at least doesn't need a whole section and a 45 min discussion ,3.833333333,4.916666667,3.125,4.125,42,57,31,34
Female ,24,1,1,1,.,.,.,1,Non-violent crisis intervention ,4,3,2,4,4,2,2,2,2,2,2,2,2,2,2,2,2,2,3,4,4,4,4,4,5,4,4,4,4,4,4,4,3,4,4,4,4,4,4,4,5,5,5,5,4,4,5,4,4,4,4,4,4,More aware of trauma informed care. Being in the restraints allowed me to feel what it may be like for patients ,.,4,.,2.583333333,4.083333333,2.375,3.875,26,48,27,36
Female ,24,3,1,1,.,.,.,.,.,4,4,1,5,5,2,2,2,2,4,3,3,4,3,2,2,2,2,2,2,5,5,5,5,5,4,4,4,4,5,4,4,4,4,4,4,4,4,4,4,5,5,5,5,5,5,4,4,4,4,4,4,4,If I ever need to restrain someone I will know what to think about and hopefully know what to do ,.,5,Instructors were knowledgeable and helpful,3.083333333,4.5,2.375,4,34,50,28,36
Male ,24,1,1,1,.,",",1,2,.,4,4,4,4,4,1,1,1,1,4,2,2,3,1,1,1,1,1,4,3,4,4,4,4,4,4,4,4,4,4,4,4,4,4,4,4,4,4,4,4,5,3,1,4,1,3,4,4,3,3,4,3,3,.,.,4,.,2.666666667,4,1.875,4,22,48,25,29
Male ,24,1,2,2,.,2,2,2,.,2,2,2,3,3,1,1,1,1,2,1,1,2,1,1,1,1,1,1,1,4,4,4,4,3,4,4,4,4,4,4,4,4,3,4,4,4,4,3,3.5,5,5,5,4,4,4,4,4,4,4,4,4,4,De-escalating client bfore restraints even need to be used. Practicing trauma aware consideration and debriefs when restraints implemented ,.,5,A solid introduction to de-escalation strategies I look forward to reinforcing what I learned when I start clinical. ,1.666666667,3.916666667,1.125,3.6875,16,46,20,33.5
Female,24,1,.,.,.,.,.,1,TIDES Fall 2019,4,.,3,4,4,1,1,1,1,4,1,1,2,1,1,1,1,1,2,1,4,5,5,5,5,5,4,4,4,5,4,4,3,3,4,4,3,3,2,3,5,4,4,5,3,3,5,4,4,3,2,3,3,Trauma informed care for restraints and thinking how being put in restraints can be traumatic. Now have hands on practice with restraints ,.,5,.,2.083333333,4.5,1.25,3.125,19,49,24,29
Female ,24,1,1,1,.,.,.,.,.,4,2,3,3,2,1,1,1,1,1,1,1,1,1,1,1,1,1,1,1,4,4,5,5,4,4,4,4,4,4,4,4,2,4,5,5,5,5,4,5,5,5,5,5,5,5,5,4,3,4,4,4,4,Being more trauma-aware during a restraint process- putting legs close to each other ,.,5,.,1.75,4.166666667,1,4.375,13,48,22,39
Female ,24,1,1,1,.,2,2,2,.,4,4,3,4,5,4,3,3,3,4,2,3,3,1,1,1,1,1,2,2,4,4,3,5,5,4,4,4,4,4,4,4,4,3,4,4,4,4,4,4,5,4,5,5,5,5,5,4,3,4,4,4,4,.,.,4,More time practicing mechanical restraints,3.5,4.083333333,1.5,3.875,33,48,22,35
Female ,24,5,1,1,.,.,.,.,.,3,3,4,4,3,3,4,3,3,3,4,5,3,4,4,4,4,3,4,5,4,4,5,4,4,4,4,4,4,4,5,5,3,5,5,5,5,5,5,5,5,5,5,5,5,5,5,4,4,4,4,4,4,Training so useful ,I will apply in my practice. Great instructors ,.,.,3.5,4.25,3.875,4.75,43,52,33,40
Female ,24,1,2,2,,2,2,1,"TIDES DAY 1 & 2 Fall 2019, Staying Safe",4,4,4,5,3,4,4,4,4,4,4,4,3,4,4,4,3,3,4,4,4,4,3,4,3,4,4,3,3,4,3,4,3,4,4,4,3,3,3,4,4,4,4,5,5,5,5,3,2,3,3,3,3,Using more trauma informed strategies and how to debrief clients and understand the power imbalance ,.,4,.,4,3.583333333,3.625,3.5,46,43,29,30
Female,24,1,1,1,,.,.,.,.,4,4,4,4,4,3,3,3,3,4,4,4,4,4,3,3,3,3,4,4,5,5,5,5,5,5,5,5,5,5,5,5,5,5,5,5,5,5,5,5,5,5,5,5,5,5,5,4,4,4,4,4,4,.,.,5,"Excellent facilitators, clear concise, answered questions. ",3.666666667,5,3.5,5,42,60,34,40
Male,25,5,1,2,.,.,1,2,.,3,3,3,3,3,3,3,3,3,3,3,3,3,3,3,3,3,3,3,3,3,3,3,3,3,3,3,3,3,3,3,3,3,3,3,3,3,3,3,3,3,3,3,3,3,.,3,3,3,3,3,3,3,.,.,3,It's okay. ,3,3,3,3,36,36,24,24
Male,25,1,1,1,.,1,2,2,.,3,3,3,3,3,3,3,3,3,3,3,3,3,2,3,3,3,3,3,3,4,4,4,4,4,4,4,4,4,4,4,4,4,4,4,4,4,4,4,4,4,4,4,4,4,.,4,4,4,4,4,4,4,Mechanical restraint practice as I was not comfortable with the mech restraints before today ,.,4,.,3,4,2.875,4,35,48,28,32
Male,25,6,1,1,.,1,1,.,.,5,4,4,4,4,4,4,4,4,4,4,4,5,5,4,4,4,4,4,4,5,5,5,5,5,5,5,5,5,5,5,5,5,5,5,5,5,5,5,5,5,5,5,5,5,.,5,4,4,4,4,4,4,"Restraints application, hand controls while restraining on stretcher bed ",.,5,.,4.083333333,5,4.25,5,50,60,36,40
Male ,25,4,1,1,.,1,2,1,CAMH online code training ,4,5,5,3,4,4,5,5,5,5,5,5,5,5,5,5,5,5,4,5,5,5,5,4,5,5,5,5,5,5,5,4,4,5,5,5,5,4,4,5,5,4,5,5,5,5,4,4,4,4,4,4,4,Well I will use these hand techniques when in situations at work,.,5,Love the video/stretches. camhstaffand camhstaff were awesome. Maybe offer this class or other TIDES courses on weekends for your part-time/casuals who have other employment during the week. A great class! ,4.583333333,4.833333333,4.875,4.625,58,58,38,37
Female,26,2,1,1,,1,1,.,.,2,2,2,4,4,2,2,2,2,4,2,2,2,2,2,2,2,2,2,2,5,5,5,5,5,5,5,5,5,5,5,5,4,4,4,4,4,4,5,4,2,5,4,5,5,4,3,3,4,4,4,2,2,More self-care,.,5,.,2.5,5,2,4.125,28,56,28,33
.,27,3,1,1,1,.,.,.,.,4,4,4,5,5,4,4,4,4,4,4,5,4,4,4,4,4,4,4,4,4,4,4,4,4,4,4,4,4,4,4,4,4,4,4,4,4,4,4,4,5,5,5,.,.,.,.,.,.,.,.,.,.,.,.,5,.,4.25,4,4,4,50,48,32,31
Female ,27,3,1,1,.,2,2,1,.,4,4,4,4,3,2,2,2,1,2,2,3,3,3,2,2,1,2,2,3,4,4,4,5,5,5,5,5,5,5,5,5,4,4,4,4,4,4,4,4,5,5,5,5,5,5,5,4,4,4,4,4,4,.,.,5,.,2.75,4.75,2.25,4,27,56,25,36
Female,27,2,1,1,.,.,1,.,",",5,4,4,5,4,2,2,2,4,2,2,4,2,2,2,2,2,.,2,2,4,4,4,4,5,4,4,4,4,4,4,4,4,4,4,4,4,4,4,4,5,5,5,5,5,5,5,4,4,4,4,4,44,.,.,5,I am very satisfied with the training but in terms of using them in practice I think we need more staff. Ration of client to staff should be at least 5 patient to 1 staff especially in geriatric units. ,3.333333333,4.083333333,1.75,4,30,49,22,36
Female ,27,3,1,1,.,.,1,.,.,4,5,5,4,5,4,4,4,3,5,4,4,4,3,4,3,2,2,4,3,5,5,5,5,5,5,5,5,5,5,5,5,5,5,5,5,5,5,5,5,5,5,5,5,5,5,5,4,4,4,4,4,4,.,.,5,.,4.25,5,3.125,5,47,60,31,40
Female ,28,4,1,1,,2,1,2,.,1,2,1,2,2,1,1,1,1,1,1,1,1,1,1,1,1,1,1,1,4,4,4,4,4,4,4,4,4,4,4,4,2,2,2,2,2,2,2,2,3,3,3,3,2,3,3,2,2,3,3,3,3,"More ideas for self care. More knowledge of moral conflict, distress, and residue theory to inform how I deal with conflicts. ",.,4,.,1.25,4,1,2,13,40,20,20
Female ,28,3,1,1,,.,.,2,.,3,2,2,4,4,1,1,1,1,2,1,1,2,1,1,1,1,1,2,1,4,4,4,4,4,4,4,4,4,4,4,4,4,4,4,4,4,4,2,4,4,2,3,4,4,2,2,4,4,4,1,1,1,.,.,4,.,1.916666667,4,1.25,3.75,17,48,21,27
.,29,2,1,.,.,1,1,.,.,4,3,3,4,4,4,3,3,4,4,4,.,4,.,2,.,3,.,4,.,5,5,5,4,4,5,4,4,4,4,4,4,4,4,4,4,4,4,4,4,5,5,5,5,5,.,5,4,4,4,4,4,4,.,.,.,.,3.333333333,4.333333333,1.625,4,32,49,26,36
Female,29,1,1,1,.,1,1,2,.,3,3,5,4,3,3,2,2,2,4,2,2,3,3,3,2,2,2,3,3,4,4,4,4,3,4,4,4,4,4,4,4,4,4,4,4,4,4,4,4,5,2,4,4,1,2,4,4,4,4,4,4,4,"Plan to use self-care strategies white at work, along with team debriefing ",.,4,Fair,2.916666667,3.916666667,2.625,4,31,47,26,31
Female,29,4,1,1,.,1,2,2,.,5,5,5,5,5,5,5,5,5,5,5,5,5,4,4,4,4,4,4,5,5,5,5,5,5,5,5,5,5,5,5,5,5,5,5,5,5,5,5,5,5,5,5,5,5,5,5,4,4,4,4,4,4,Self care and trauma informed care ,.,5,Excellent training and solid facilitators :) ,5,5,4.25,5,57,60,37,40
Female,29,1,1,1,.,1,1,2,.,3,4,3,4,4,3,3,3,3,3,3,3,3,3,3,3,3,,4,3,4,4,4,4,4,4,4,4,4,4,4,4,2,2,2,2,2,2,2,2,3,3,3,4,4,4,4,3,4,4,4,4,4,.,.,4,.,3.25,4,2.75,2,37,40,26,21
Female,29,5,.,1,.,.,.,.,.,3,3,4,3,4,2,2,2,2,3,3,3,3,3,3,3,3,3,4,4,4,4,4,3,3,4,4,4,4,4,4,4,4,4,4,4,4,4,4,4,4,4,4,3,3,3,3,3,3,3,3,3,3,Self care check in with self and team decision -restraints?,.,4,8/10 overall good ,2.833333333,3.833333333,3.25,4,33,47,29,31
Female,29,6,1,1,.,1,1,2,.,4,2,2,4,5,2,1,1,1,4,1,1,4,1,1,1,1,1,4,1,4,4,4,4,5,4,4,4,4,4,4,.,4,.,2,2,2,2,4,5,3,4,4,4,4,4,4,3,3,3,3,1,1,.,Knowing this info is important but physically I don't feel confident in using restraint ,5,.,2.333333333,3.75,1.75,2.625,23,37,23,28
Female,29,3,1,1,.,.,.,.,.,2,1,2,4,4,1,1,1,1,1,1,1,2,1,1,1,1,1,2,1,4,4,4,4,4,4,4,4,4,4,4,4,4,4,4,4,4,4,4,4,5,3,3,4,5,.,3,4,4,4,2,2,1,.,I work on a unit that doesn't have the capacity to apply mechanical restraints,5,Overall I liked the space an improvement over TIDES 1 & 2 video - very helpful. ,1.666666667,4,1.25,4,16,48,21,31
Female,29,1,2,2,.,2,1,2,.,2,2,3,4,4,2,3,2,2,2,3,2,2,3,3,2,2,2,2,2,3,4,4,4,4,4,4,4,4,4,4,4,4,4,4,4,4,4,4,4,5,5,5,5,5,5,5,4,4,4,4,4,4,.,.,.,.,2.583333333,3.916666667,2.25,4,30,48,23,36
Female,29,2,2,1,.,2,2,2,.,3,3,2,4,4,1,1,1,1,1,1,1,2,2,2,2,2,2,2,2,5,5,5,5,5,5,5,5,5,5,5,5,5,5,5,5,5,5,5,5,.,.,.,.,.,.,.,.,.,.,.,.,.,.,.,.,.,1.916666667,5,2,5,19,60,28,20
Female,29,2,1,1,.,1,1,1,PMAB,3,3,3,3,3,3,3,3,3,3,3,3,3,3,3,3,3,3,3,3,3,3,3,3,3,3,3,3,3,3,3,3,3,3,3,3,3,3,3,3,4,4,4,4,4,4,4,4,4,4,3,3,3,Self-care and debriefing ,.,5,.,3,3,3,3,36,36,24,28
Female,29,4,1,1,.,.,.,.,.,4,4,4,4,4,4,3,3,3,3,3,3,3,4,4,3,3,3,4,4,5,5,5,5,5,5,5,5,5,5,5,5,4,5,5,5,5,5,5,5,5,5,5,5,5,5,4,4,4,4,4,4,4,.,.,5,.,3.5,5,3.5,4.875,40,59,34,40
Female,29,6,1,1,.,2,1,2,.,4,4,5,5,3,3,3,3,3,4,3,4,4,3,3,3,3,3,4,4,4,4,4,4,4,4,4,4,4,4,4,4,4,4,4,4,4,4,4,4,3,4,5,4,5,5,4,4,4,4,4,4,4,.,.,5,.,3.666666667,4,3.375,4,39,48,30,32
Female,29,3,1,1,.,1,1,2,.,4,4,4,4,3,3,3,3,3,4,3,3,3,3,3,3,3,3,4,4,5,5,5,5,4,5,5,5,5,4,4,5,4,4,4,4,4,4,4,4,5,5,5,5,5,5,5,4,4,4,4,3,3,Will not forget about self-care ,.,4,.,3.416666667,4.75,3.25,4,37,53,34,36
Female,29,2,1,1,.,1,2,2,.,4,4,4,4,4,3,3,3,3,3,3,4,4,3,3,3,3,3,4,4,4,4,4,4,4,4,4,3,3,4,4,5,4,4,3,3,3,3,4,4,4,4,4,5,4,4,3,3,3,2,3,2,2,Trauma-informed de-esclation prior to use of restraints ,.,4,.,3.5,3.916666667,3.375,3.5,39,45,30,31
.,29,2,1,1,.,1,1,1,CPI,4,4,4,5,3,3,3,3,3,4,4,4,4,4,3,3,3,3,3,4,4,4,4,4,4,4,4,4,4,4,4,4,4,4,4,4,4,4,4,4,3,3,3,3,3,2,3,4,4,4,4,1,1,Debriefing and self-care ,.,3,More info on debriefing strategies ,3.666666667,4,3.375,4,41,48,29,28
Female,29,1,1,1,.,1,1,.,.,4,3,3,3,3,1,1,1,1,3,2,2,3,3,1,1,1,1,2,3,4,4,4,4,4,4,4,4,4,4,4,4,4,4,4,4,4,4,4,4,5,4,5,4,3,2,2,4,4,4,1,1,1,.,Do not use restraints on unit ,4,.,2.25,4,1.875,4,22,48,23,34
